doc_id,title,author,pub_date,source_url,cleaned_text,token_count,vocab_size
1,How Google’s DeepMind tool is ‘more quickly’ forecasting hurricane behavior,Eric Holthaus,2025-11-16T13:00:32.000Z,https://www.theguardian.com/technology/2025/nov/16/google-deepmind-hurricane-forecast,"‘Less expensive and time consuming’ model helps with fast and accurate predictions, possibly saving lives and property When then Tropical Storm Melissa was churning south of Haiti, Philippe Papin, a National Hurricane Center (NHC) meteorologist, had confidence it was about to grow into a monster hurricane. As the lead forecaster on duty, he predicted that in just 24 hours the storm would become a category 4 hurricane and begin a turn towards the coast of Jamaica. No NHC forecaster had ever issued such a bold forecast for rapid strengthening. But Papin had an ace up his sleeve: artificial intelligence in the form of Google’s new DeepMind hurricane model – released for the first time in June. And, as predicted, Melissa did become a storm of astonishing strength that tore through Jamaica. Forecasters at the NHC are increasingly leaning hard on Google DeepMind. On the morning of 25 October, Papin explained in his public discussion and on social media that Google’s model was a primary reason he was so confident : “Roughly 40/50 Google DeepMind ensemble members show Melissa becoming a Category 5. While I am not ready to forecast that intensity yet given the track uncertainty, that remains a possibility. “It appears likely that a period of rapid intensification will occur as the storm moves slowly over very warm ocean waters which is the highest oceanic heat content in the entire Atlantic basin.” Google DeepMind is the first AI model dedicated to hurricanes , and now the first to beat traditional weather forecasters at their own game. Through all 13 Atlantic storms so far this year , Google’s model is the best – even beating human forecasters on track predictions. Melissa eventually made landfall in Jamaica at category 5 strength, one of the strongest landfalls ever documented in nearly two centuries of record-keeping across the Atlantic basin. Papin’s bold forecast likely gave people in Jamaica extra time to prepare for the disaster, possibly saving lives and property. Google DeepMind has been making weather forecasts for a few years now , and the parent forecast system from which the new hurricane model is derived also performed spectacularly well in diagnosing large-scale weather patterns last year. Google’s model works by spotting patterns that traditional time-intensive physics-based weather models may miss. “They do it much more quickly than their physics-based cousins, and the computing power is less expensive and time consuming,” Michael Lowry, a former NHC forecaster, said. “What this hurricane season has proven in short order is that the newcomer AI weather models are competitive with and, in some cases, more accurate than the slower physics-based weather models we’ve traditionally leaned on,” Lowry said. To be sure, Google DeepMind is an example of machine learning – a technique that has been used in data-heavy sciences like meteorology for years – and is not generative AI like ChatGPT. Machine learning takes mounds of data and pulls out patterns from them in a such a way that its model only takes a few minutes to come up with an answer, and can do so on a desktop computer – in strong contrast to the flagship models that governments have used for decades that can take hours to run and require some of the biggest supercomputers in the world . Still, the fact that Google’s model could outperform previous gold-standard legacy models so quickly is nothing short of amazing to meteorologists who have spent their careers trying to forecast the world’s strongest storms. Sign up to First Thing Our US morning briefing breaks down the key stories of the day, telling you what’s happening and why it matters after newsletter promotion “I’m impressed,” said James Franklin, a retired NHC forecaster. “The sample is now large enough that it’s pretty clear this is not a case of beginner’s luck.” Franklin said that although Google DeepMind is beating all other models on forecasting the future path of hurricanes worldwide this year, like many AI models it occasionally gets high-end intensity forecasts wrong . It struggled with Hurricane Erin earlier this year, as it was also undergoing rapid intensification to category 5 north of the Caribbean. It also struggled with Typhoon Kalmaegi – which made landfall in the Philippines on Monday. In the coming offseason, Franklin said he plans to talk with Google about how it can make the DeepMind output even more helpful for forecasters by providing additional under-the-hood data they can use to assess exactly why it is coming up with the its answers. “The one thing that nags at me is that while these forecasts seem to be really, really good, the output of the model is kind of a black box,” said Franklin. There has never been a private, for-profit company that has produced a top-level weather model which allows researchers a peek into its methods – unlike nearly all other models which are provided free to the public in their entirety by the governments that designed and maintain them. While Google has made top-level output of DeepMind publicly available in real time on a dedicated website , its methods have still largely been hidden. Google is not alone in starting to use AI to solve difficult weather forecasting problems. The US and European governments also have their own AI weather models in the works – which have also shown improved skill over previous non-AI versions . The next steps in AI weather forecasts seem to be startup companies taking swings at previously tough-to-solve problems such as sub-seasonal outlooks and better advance warnings of tornado outbreaks and flash flooding – and they are receiving US government funding to do so . One company, WindBorne Systems, is even launching its own weather balloons to fill the gaps in the US weather-observing network, which has recently been downsized by the Trump administration . Google Hurricanes Artificial intelligence (AI) Hurricane Melissa Natural disasters US weather news",1083,452
2,AI slop tops Billboard and Spotify charts as synthetic music spreads,Aisha Down,2025-11-13T21:58:04.000Z,https://www.theguardian.com/technology/2025/nov/13/ai-music-spotify-billboard-charts,"Hits include country songs and a Dutch anti-refugee anthem, both entirely made without human composition Three songs generated by artificial intelligence topped music charts this week, reaching the highest spots on Spotify and Billboard charts. Walk My Walk and Livin’ on Borrowed Time by the outfit Breaking Rust topped Spotify’s “Viral 50” songs in the US, which documents the “most viral tracks right now” on a daily basis, according to the streaming service. A Dutch song, We Say No, No, No to an Asylum Center, an anti-migrant anthem by JW “Broken Veteran” that protests against the creation of new asylum centers, took the top position in Spotify’s global version of the viral chart around the same time. Breaking Rust also appeared in the top five on the global chart. “You can kick rocks if you don’t like how I talk,” reads a lyric from Walk My Walk, a seeming double entendre challenging those opposed to AI-generated music. Days after its ascent up the charts, the Dutch song disappeared from Spotify and YouTube, as did Broken Veteran’s other music. Spotify told the Dutch outlet NU.nl that the company had not removed the music, the owners of the song rights had. Broken Veteran told the outlet that he did not know why his music had disappeared and that he was investigating, hoping to return it soon. In an email to the Guardian, Broken Veteran, who declined to give his real name, said that he saw AI as “just another tool for expression, particularly valuable for people like me who have something to say but lack traditional musical training”, adding that the technology had “democratized music creation”. He claimed his songs “express frustration with governmental policies, not with migrants as individuals”. For three weeks, Walk My Walk has led Billboard’s “Country Digital Song Sales” chart, which measures downloads and digital purchases. The list is minor in comparison to Billboard’s “Hot Country Songs” or “Top Country Albums”, which measure a broader range of signals of success. Breaking Rust did not respond to a request for comment. AI-made music spreads These three songs are part of a flood of AI-generated music that has come to saturate streaming platforms. A study published on Wednesday by the streaming app Deezer estimates that 50,000 AI-generated songs are uploaded to the platform every day – 34% of all the music submitted. Walk My Walk and We Say No, No, No to an Asylum Center, aren’t the first AI-generated songs to reach a mass audience. Over the summer, AI-generated songs from a group going by the name Velvet Sundown amassed over a million streams on Spotify, in what one member later described as an “art hoax”. Ed Newton-Rex, a musician and the founder of a non-profit that certifies generative AI companies’ data training practices as fair to artists, says that the sheer number of AI-generated songs now online is a key factor driving the ascent of a few AI-generated hits. “It’s part of the very rapid trend of AI music gaining in popularity essentially because it’s spreading in volume,” he said. “What you have here is 50,000 tracks a day that are competing with human musicians. You have a new, hyperscalable competitor and, moreover, this competitor that was built by exploitation.” AI music has improved in quality from its early, clanking days. As part of its study, Deezer surveyed 9,000 people in eight countries and found that 97% could not distinguish between AI-generated music and human-written music. “There’s no denying it. I think it’s fair to say you can’t distinguish the best AI music from human-composed music now,” Newton-Rex said. Sign up to TechScape A weekly dive in to how technology is shaping our lives after newsletter promotion New distribution models for AI-made music Human-level quality is not the only reason for the success of AI-generated tracks on Spotify. As with many parts of the AI slop economy, there are a set of tools and platforms out there that enable AI music to spread easily – and sub-communities of users eager to share tips to game the system. Jack Righteous, a blog on AI content creation, recommends that its followers generate “streams of passive income” using a music distribution service called DistroKid, which funnels royalties to music creators every time their AI tracks are streamed on YouTube, Spotify or TikTok. DistroKid is part of an ecosystem of online music distribution services, such as Amuse , Landr and CDBaby , which help creators place their music on major platforms like YouTube and Spotify. These services have varied policies on AI-generated content, and blogs describe DistroKid’s as “more lenient”. Several hits from Breaking Rust, including Livin’ on Borrowed Time and Resilient , appear to be distributed by DistroKid. “Basically every piece of AI music you see isn’t distributed by a regular label. They’re made by a person in their bedroom and uploaded to these distribution sites,” said Chris Dalla Riva, author of the book Uncharted Territory , on the data behind music virality. When reached for comment, Spotify pointed to its policy on AI-generated tracks . Artificial intelligence (AI) news",1000,399
3,AI firm claims it stopped Chinese state-sponsored cyber-attack campaign,Aisha Down,2025-11-14T16:27:57.000Z,https://www.theguardian.com/technology/2025/nov/14/ai-anthropic-chinese-state-sponsored-cyber-attack,"Anthropic says financial firms and government agencies were attacked ‘largely without human intervention’ A leading artificial intelligence company claims to have stopped a China-backed “cyber espionage” campaign that was able to infiltrate financial firms and government agencies with almost no human oversight. The US-based Anthropic said its coding tool, Claude Code, was “manipulated” by a Chinese state-sponsored group to attack 30 entities around the world in September, achieving a “handful of successful intrusions”. This was a “significant escalation” from previous AI-enabled attacks it monitored, it wrote in a blogpost on Thursday , because Claude acted largely independently: 80 to 90% of the operations involved in the attack were performed without a human in the loop. “The actor achieved what we believe is the first documented case of a cyber-attack largely executed without human intervention at scale,” it wrote. Anthropic did not clarify which financial institutions and government agencies had been targeted, or what exactly the hackers had achieved – although it did say they were able to access their targets’ internal data. It said Claude had made numerous mistakes in executing the attacks, at times making up facts about its targets, or claiming to have “discovered” information that was free to access. Policymakers and some experts said the findings were an unsettling sign of how capable certain AI systems have grown: tools such as Claude are now able to work independently over longer periods of time. “Wake the f up. This is going to destroy us – sooner than we think – if we don’t make AI regulation a national priority tomorrow,” the US senator Chris Murphy wrote on X in response to the findings. “AI systems can now perform tasks that previously required skilled human operators,” said Fred Heiding, a computing security researcher at Harvard University. “It’s getting so easy for attackers to cause real damage. The AI companies don’t take enough responsibility.” Other cybersecurity experts were more sceptical, pointing to inflated claims about AI-fuelled cyber-attacks in recent years – such as an AI-powered “password cracker” from 2023 that performed no better than conventional methods – and suggesting Anthropic was trying to create hype around AI. “To me, Anthropic is describing fancy automation, nothing else,” said Michał Woźniak, an independent cybersecurity expert. “Code generation is involved, but that’s not ‘intelligence’, that’s just spicy copy-paste.” Woźniak said Anthropic’s release was a distraction from a bigger cybersecurity concern: businesses and governments integrating “complex, poorly understood” AI tools into their operations without understanding them, exposing them to vulnerabilities. The real threat, he said, were cybercriminals themselves – and lax cybersecurity practices. Sign up to TechScape A weekly dive in to how technology is shaping our lives after newsletter promotion Anthropic, like all leading AI companies, has guardrails that are supposed to stop its models from assisting in cyber-attacks – or promoting harm generally. However, it said, the hackers were able to subvert these guardrails by telling Claude to role-play being an “employee of a legitimate cybersecurity firm” conducting tests. Woźniak said: “Anthropic’s valuation is at around $180bn, and they still can’t figure out how not to have their tools subverted by a tactic a 13-year-old uses when they want to prank-call someone.” Marius Hobbhahn, the founder of Apollo Research, a company that evaluates AI models for safety, said the attacks were a sign of what could come as capabilities grow. “I think society is not well prepared for this kind of rapidly changing landscape in terms of AI and cyber capabilities. I would expect many more similar events to happen in the coming years, plausibly with larger consequences.” The best public interest journalism relies on first-hand accounts from people in the know. If you have something to share on this subject, you can contact us confidentially using the following methods. Secure Messaging in the Guardian app The Guardian app has a tool to send tips about stories. Messages are end to end encrypted and concealed within the routine activity that every Guardian mobile app performs. This prevents an observer from knowing that you are communicating with us at all, let alone what is being said. If you don't already have the Guardian app, download it ( iOS / Android ) and go to the menu. Select ‘Secure Messaging’. SecureDrop, instant messengers, email, telephone and post If you can safely use the Tor network without being observed or monitored, you can send messages and documents to the Guardian via our SecureDrop platform . Finally, our guide at theguardian.com/tips lists several ways to contact us securely, and discusses the pros and cons of each. Artificial intelligence (AI) Computing Cybercrime China Asia Pacific Internet news",901,422
4,"Risks to children playing Roblox ‘deeply disturbing’, say researchers",Libby Brooks,2025-04-14T11:00:42.000Z,https://www.theguardian.com/technology/2025/apr/14/risks-children-roblox-deeply-disturbing-researchers,"Exclusive: Gaming platform accused of ‘troubling disconnect between child-friendly appearance and reality’ ‘A man approached him’: parents describe their children’s Roblox problems “Deeply disturbing” research exposes how easy it is for children to encounter inappropriate content and interact unsupervised with adults on the gaming platform Roblox. It comes as parents shared their serious concerns about children experiencing addiction, seeing traumatising content and being approached by strangers on the hugely popular website and app. Roblox acknowledges that children using the platform may be exposed to harmful content and “bad actors”. It says it is working hard to fix this, but that industry-wide collaboration and government intervention are needed. Describing itself as “the ultimate virtual universe”, Roblox features millions of games and interactive environments, known collectively as “experiences”. Some of the content is developed by Roblox, but much of it is user-generated. In 2024, the platform had more than 85 million daily active users, an estimated 40% of whom are under 13. While the company said it “deeply sympathised” with parents whose children came to harm on the platform, it said “tens of millions of people have a positive, enriching and safe experience on Roblox every day”. However, in an investigation shared with the Guardian , the digital-behaviour experts Revealing Reality discovered “something deeply disturbing … a troubling disconnect between Roblox’s child-friendly appearance and the reality of what children experience on the platform”. Revealing Reality created multiple Roblox accounts, registering them to fictional users aged five, nine, 10, 13 and 40-plus. The accounts interacted only with one another, and not with users outside the experiment, to ensure their avatars’ behaviours were not influenced in any way. Despite new tools launched last week aimed at giving parents more control over their children’s accounts, the researchers concluded: “Safety controls that exist are limited in their effectiveness and there are still significant risks for children on the platform.” The report found that children as young as five were able to communicate with adults while playing games on the platform, and found examples of adults and children interacting with no effective age verification. This was despite Roblox changing its settings last November so that accounts listed as belonging to under-13s can no longer directly message others outside of games or experiences, instead having access only to public broadcast messages. The report also found the avatar belonging to the 10-year-old’s account could access “highly suggestive environments”. These included a hotel space where they could view a female avatar wearing fishnet stockings gyrating on a bed and other avatars lying on top of each other in sexually suggestive poses, and a public bathroom space where characters were urinating and avatars could choose fetish accessories to dress up in. Researchers found that their test avatars overheard conversations between other players verbalising sexual activity, as well as repeated slurping, kissing and grunting noises, when using the voice chat function. Roblox says that all voice chat – which is available to phone-verified accounts registered as belonging to users aged 13 and above – is subject to real-time AI moderation. They also found that a test avatar registered to an adult was able to ask for the five-year-old test avatar’s Snapchat details using barely coded language. Though Roblox says in-game text chat is subject to built-in filters and moderation, the report says this is an example of how easily such measures can be circumvented, creating opportunities for predatory behaviour. Sign up to Pushing Buttons Keza MacDonald's weekly look at the world of gaming after newsletter promotion Roblox said it recognised “there are bad actors on the internet” but added this was “an issue that goes beyond Roblox and needs to be addressed through collaboration with governments and an industry-wide commitment to strong safety measures across all platforms”. It also acknowledged that age verification for under-13s “remains an industry challenge”. Stories shared by parents following a Guardian Community callout include that of a 10-year-old boy who was groomed by an adult he met on the platform, and a nine-year-old girl who started having panic attacks after seeing sexual content while gaming. Damon De Ionno, the research director of Revealing Reality, said: “The new safety features announced by Roblox last week don’t go far enough. Children can still chat with strangers not on their friends list, and with 6 million experiences [on the platform], often with inaccurate descriptions and ratings, how can parents be expected to moderate?” The crossbench peer and internet safety campaigner Beeban Kidron said the research exposed the platform’s “systematic failure to keep children safe”, adding: “This kind of user research should be routine for a product like Roblox.” Matt Kaufman, the chief safety officer at Roblox, said: “Trust and safety are at the core of everything we do. We continually evolve our policies, technologies, and moderation efforts to protect our community, especially young people. This includes investing in advanced safety tools, working closely with experts and empowering parents and caregivers with robust controls and resources. “In 2024 alone, we added more than 40 new safety enhancements, and we remain fully committed to going further to make Roblox a safe and civil place for everyone .” Children's tech Internet safety Games Online multiplayer games Children Parents and parenting news",998,436
