doc_id,title,author,pub_date,source_url,cleaned_text,token_count,vocab_size
12,A puppy and unlimited toilet paper? Legal experts say Ghislaine Maxwell’s alleged prison life is uncommon,Victoria Bekiempis,2025-11-16T13:00:32.000Z,https://www.theguardian.com/us-news/2025/nov/16/ghislaine-maxwell-low-security-prison-treatment,"Maxwell is serving a 20-year sentence for her role in Jeffrey Epstein’s sex-trafficking of teen girls – and her treatment is prompting speculation S ince Ghislaine Maxwell ’s controversial transfer to a low-security prison camp this summer, her time at Texas’s FPC Bryan has prompted uproar over alleged favorable treatment – including claims this week that she was provided custom-made meals, access to a puppy and as much toilet paper as she wants. Some of the recent accusations were in a 9 November letter thatJamie Raskin sent to Donald Trump. The Democratic representative’s letter, which cited whistleblower information, demanded answers about Maxwell’s conditions – including whether Trump directed anyone in his administration to give her special treatment. Whistleblower disclosures, Raskin said, also revealed that Maxwell was working on a “commutation application” with Trump’s administration. Maxwell is currently serving a 20-year sentence for her role in Jeffrey Epstein ’s sex trafficking of teen girls, a scandal that has dogged Trump for years and has recently hit a feverish pitch during his second term. The special treatment and the alleged request for a commutation of her sentence has prompted feverish speculation as to why Maxwell is getting such treatment and whether or not Trump could pardon her. The disgraced socialite’s team on Friday denied that she was seeking clemency. Though both Maxwell and Trump have denied the US president was involved in, or knew of, Epstein’s wrongdoing, the former British socialite remains at the center of the scandal. That was heightened this week when amid of trove of released emails there was a message between Epstein and Maxwell that referred to Trump as “the dog that hasn’t barked” and said he had spent considerable time with one of the victims. Certainly, Maxwell’s treatment after she was transferred from Florida to her new, much more relaxed prison in Texas is eye-catching. More perks allegedly afforded to Maxwell included a special area where she can receive visitors, replete with “an assortment of snacks and refreshments for her guests”, and treating the warden as “her personal secretary and administrative assistant”. CNN reported she could have unlimited toilet paper. As for the aforementioned puppy? “An inmate who trains puppies to become service dogs was instructed to provide one to Maxwell for a time so she could play with the puppy, even though neither inmates nor staff are ordinarily allowed to pet the service dogs in training. “The deference and servility to Ms Maxwell have reached such preposterous levels that one of the top officials at the facility has complained that he is ‘sick of having to be Maxwell’s bitch’,” Raskin also said. This application, Raskin said, demonstrated “either that Ms Maxwell is herself requesting you release her from her 20-year prison sentence for her role as a coconspirator in Jeffrey Epstein’s international child sex-trafficking ring, or that this child sex predator now holds such tremendous sway in the second Trump administration that you and your DOJ will follow her clemency recommendations”. While the White House has previously said “pardoning Ghislaine Maxwell is not something [Trump] has thought about”, legal veterans told the Guardian that this kind of alleged treatment is uncommon, and raises the specter of still more favorable developments for Maxwell. “The government isn’t going to give an incarcerated prisoner all of these perks in exchange for nothing,” said Eric Faddis, founder of the Colorado law firm Varner Faddis and a former prosecutor. “What it tells me is that the government believes they received something of value from Ghislaine and this is sort of her reward.” Faddis said that he had seen inmates improve their lot by cooperating with the government and providing information deemed “useful” but not to the extent alleged. “It seems like the government gave, perhaps special preference, to Ghislaine based on the ostensible weight of the information she provided and its value.” Neama Rahmani, founder of West Coast Trial Lawyers and a former federal prosecutor, said “this is not typical”. Sex trafficking and other sex-related crimes are considered crimes of violence. Inmates convicted of them are typically isolated from the general population because they are considered dangerous and “they’re also at increased risk of being attacked or killed by other inmates”. “They’re segregated, they’re in administrative custody. They’re generally not in a low-security facility with the general population,” Rahani said. “The fact that she’s allegedly getting these special meals, visits, puppy access – that is not standard, that is not typical in these types of cases.” If the allegations about special treatment were true, including seeming irregularity surrounding her placement, it could be a quid pro quo, such as a “we’re gonna give you benefits because you’re keeping your mouth shut and not implicating people in power or with money”. That said, it could be some completely benign, such as “there’s not a whole lot of placements for female inmates in the federal system, and this is the best the BOP had”. John Day, a former prosecutor in New Mexico who founded the John Day Law Office, voiced similar sentiments about the alleged perks. “Even if it’s 50% exaggerated, it’s still outrageous – and it indicates some type of favorable treatment that no one else could get unless you were connected in the right ways,” he said. “These are the kind of privileges that are given to someone who has done something in return,” Day continued. This is not normal treatment for the crime she was convicted of, and it raises all sorts of questions about the propriety of it, and who’s behind it, and what the motive is.” Larry Levine, founder of Wall Street Prison Consultants and a former federal inmate, was skeptical of the whistleblower allegations. With special meal claims, for example, Levine said inmates figure out how to prepare and eat bespoke meals, including by pilfering food from the kitchen. “I used to have omelets and chicken breast and veal parmesandelivered to my cell that was made by an inmate,” he said. “It was ‘special’ food because no one else had it.” Levine said it was “possible” BOP staff were preparing food for Maxwell but thought it very unlikely. “That would cause big, big, big problems with the inmates … Why is she getting this and we have to eat this crap here?” he said. “It would cause civil unrest in there.” He also wasn’t shocked by the claim that Maxwell received visitors in a cordoned-off area. In a visiting room, where there are many inmates and visitors, “everyone’s going to be gawking at her”, and officials might determine that keeping her separate fosters safety and security. “I’ve seen that happen before.” Levine was emphatic, however, that Maxwell’s move to the Texas prison was “unprecedented”. Under Bureau of Prisons guidelines, sex offenders present safety concerns that do not permit their incarceration at low-security institutions such as Bryan. “There’s your big special privilege.” It is unclear what these alleged privileges mean for Maxwell’s future, if anything. Levine noted that thousands seek commutations and that the process is backed up. “So could she ask? Sure, but I don’t think she’s going to get it.” That said, “with Trump, everything’s in the air.” Rahmani said he believed that Maxwell was seeking a commutation, especially given that the US supreme court declined to hear her appeal. “There’s no doubt in my mind that Maxwell and her team are lobbying the president. I would be shocked if the president were actually to do this, but you never know when it comes to Trump.” He pointed to Maxwell’s sit-down with Todd Blanche, the deputy attorney general who previously served as Trump’s personal lawyer. “It is pretty rare for someone with his title and position in the DoJ to handle a case personally,” he said. “So you know, she does have some access that most folks do not.” Given the cumulative circumstances, Day said, “You take it all together, nobody should be surprised if the next step is a commutation or a pardon. “That seems to be where all the arrows are pointing and if you follow all the breadcrumbs.” Maxwell’s team insisted that she was taking steps outside of seeking clemency, claiming that she will soon be filing a habeas petition in Manhattan federal court to challenge her conviction. “In the four years since the verdict new evidence has indeed come to light – and is continuing to do so,” Leah Saffian, counsel to Maxwell, said in a statement. “Habeas petitions are distinct from petitions to the supreme court, in that they relate to prisoners’ rights and conviction challenges,” the statement said at another point. “Prior to any such [pardon] application a prisoner needs to demonstrate that all possible avenues of appeal have been exhausted.” The Guardian has reached out to the White House and the Department of Justice for comment. The White House pointed to comments from Karoline Leavitt, the press secretary, earlier this week when a reported asked about whether Trump was considering a pardon for Maxwell. “He’s answered this repeatedly. It’s not something he’s talking about or even thinking about at this moment in time. I can assure you of that,” she said. The justice department referred the Guardian to the Bureau of Prisons. The Bureau of Prisons said in a statement that “allegations of misconduct, including any suggestion of preferential treatment, are taken seriously and thoroughly investigated” through internal processes. It added that violations of this policy can result in disciplinary action that can include firing and prosecution. The BOP’s standards of employee conduct “explicitly prohibits all staff from providing preferential treatment to any inmate”, the agency said. Ghislaine Maxwell US prisons Jeffrey Epstein Donald Trump Law (US) features",1930,643
13,Texas trooper sent home after confronting South Carolina player during game,Tom Lutz,2025-11-15T22:36:47.000Z,https://www.theguardian.com/sport/2025/nov/15/texas-trooper-sent-home-after-confronting-south-carolina-players-during-game,"Trooper exchanged words with Nyck Harbor Trooper exchanged words with Nyck Harbor LeBron James among critics on social media LeBron James among critics on social media A Texas trooper who confronted South Carolina’s Nyck Harbor after the player’s touchdown on Saturday was sent home from the game, according to the state’s Department of Public Safety. Harbor scored on an 80-yard reception in the second quarter and entered the tunnel after the score, appearing to walk off a leg injury. As he and three of his teammates, including running back Oscar Adaway III, were walking back to the field, the trooper walked in between Harbor and Adaway and bumped into them . The trooper pointed at Harbor and Adaway, appearing to admonish them. Harbor was quickly pushed away by a teammate as they continued make their way towards the field. This article includes content hosted on embed.bsky.app . We ask for your permission before anything is loaded, as the provider may be using cookies and other technologies. To view this content, click 'Allow and continue' . The video was widely shared on social media with many commenting on it, including LeBron James. “That A&M cop needs to suspended! That was premeditated and corny AF!! . He went out his way to start some shit. Do better man,” wrote James on X . The Texas Department of Public Safety Department, which employs the trooper, issued a statement saying he had been sent home from Kyle Field, Texas A&M’s home stadium. “Our Office of Inspector General is also aware of the incident and will be further looking into the matter. No additional information will be released at this time,” the statement read. South Carolina head coach Shane Beamer said he was pleased action had been taken against the trooper. “Got a ton of respect for the people here in College Station,” Beamer said after the game. “They’re just a first-class operation, everybody. From a game operation standpoint, they really do a great job. They’re first-class people, so appreciate them handling that the right way, sending [the trooper] home.” Texas A&M rallied from 27 points down to complete a remarkable 31-30 win over South Carolina to remain undefeated this season. Harbor left the game in the fourth quarter after sustaining a suspected chest injury when another player landed on him while he made a catch. Beamer said the 20-year-old was taken to hospital as a precautionary measure accompanied by his father Jean, a former professional soccer player who won 15 caps for the US men’s national team. Nyck Harbor won the 2023 Franklin D Watkins Memorial Award , a prize which honors African American high schoolers who excel in athletics, academics and charity work. Aside from his football career, Harbor has won national titles in track, volunteered at a soup kitchen and worked with Generosity Global, which campaigns to improve women’s health in Africa. Harbor is majoring in public health and has been on the SEC Academic Honor Roll two years in succession. College football College sports US sports Texas news",587,288
14,Ukraine war briefing: Drones hit Russia’s Ryazan oil refinery,Warren Murray,2025-11-16T02:31:15.000Z,https://www.theguardian.com/world/2025/nov/16/ukraine-war-briefing-drones-hit-russias-ryazan-oil-refinery,"Russian attacks kill four on Saturday; Serbian government faces deadline to oust Russian owners from state oil company. What we know on day 1,362 Ukraine’s army said on Saturday it struck a Russian oil refinery in the Ryazan region near Moscow, as “part of efforts to reduce the enemy’s ability to launch missile and bomb strikes” . Explosions and a large fire were observed at the site, said the military. Ryazan is located about 200km (125 miles) south-east of Moscow. Ukraine’s army said on Saturday it struck a Russian oil refinery in the Ryazan region near Moscow, as “part of efforts to reduce the enemy’s ability to launch missile and bomb strikes” . Explosions and a large fire were observed at the site, said the military. Ryazan is located about 200km (125 miles) south-east of Moscow. Russian officials often do not admit such attacks have succeeded , and the Ryazan governor, Pavel Malkov, adopted the standard line that Ukrainian drones were shot down but debris happened to hit the target. “Falling debris caused a fire on the premises of one enterprise,” Malkov said. A wave of 25 Ukrainian drones attacked the region, Malkov said. Russian officials often do not admit such attacks have succeeded , and the Ryazan governor, Pavel Malkov, adopted the standard line that Ukrainian drones were shot down but debris happened to hit the target. “Falling debris caused a fire on the premises of one enterprise,” Malkov said. A wave of 25 Ukrainian drones attacked the region, Malkov said. Officials in southern Ukraine said four people were killed by Russian attacks on Saturday . Prosecutors in the Kherson region said “three civilians are known to have been killed” in the village of Myklitskyi and the city of Kherson. The governor of the Zaporizhzhia region, Ivan Federov, said a Russian attack killed one person. Officials in southern Ukraine said four people were killed by Russian attacks on Saturday . Prosecutors in the Kherson region said “three civilians are known to have been killed” in the village of Myklitskyi and the city of Kherson. The governor of the Zaporizhzhia region, Ivan Federov, said a Russian attack killed one person. The US will not lift sanctions on Serbian oil company NIS unless Belgrade terminates the firm’s majority Russian ownership , Serbia’s energy minister said on Saturday, warning that her country faced “difficult” decisions. Washington sanctioned Petroleum Industry of Serbia (NIS) as part of its crackdown on the Russian energy sector. Analysts say Serbia is on the brink of a winter energy crisis with its lone oil refinery facing a potential shutdown. The US will not lift sanctions on Serbian oil company NIS unless Belgrade terminates the firm’s majority Russian ownership , Serbia’s energy minister said on Saturday, warning that her country faced “difficult” decisions. Washington sanctioned Petroleum Industry of Serbia (NIS) as part of its crackdown on the Russian energy sector. Analysts say Serbia is on the brink of a winter energy crisis with its lone oil refinery facing a potential shutdown. Serbia’s energy minister, Dubravka Đedović Handanović, said the US wanted a “complete change of Russian shareholders” to be negotiated by 13 February before lifting sanctions . NIS is 45% owned by Gazprom Neft, which has been targeted by US sanctions. Neft’s parent company, Gazprom, has transferred its own 11.3% stake in NIS to another Russian firm, Intelligence. The Serbian state holds nearly 30% of NIS, with the rest owned by minority shareholders. Handanović suggested the Serbian government was looking at a possible Russian takeover of NIS and would hold a special cabinet meeting about it on Sunday. Serbia’s energy minister, Dubravka Đedović Handanović, said the US wanted a “complete change of Russian shareholders” to be negotiated by 13 February before lifting sanctions . NIS is 45% owned by Gazprom Neft, which has been targeted by US sanctions. Neft’s parent company, Gazprom, has transferred its own 11.3% stake in NIS to another Russian firm, Intelligence. The Serbian state holds nearly 30% of NIS, with the rest owned by minority shareholders. Handanović suggested the Serbian government was looking at a possible Russian takeover of NIS and would hold a special cabinet meeting about it on Sunday. Ukraine has recorded a threefold increase in the number of attacks on its railway system since July , according to a senior minister, as Moscow seeks to scupper one of Kyiv’s key logistical systems, Peter Beaumont writes . The rail network carries more than 63% of the country’s freight – including grain shipments – and 37% of passenger traffic, according to the state statistics service. Military assistance from foreign countries often arrives by train. Oleksii Kuleba, a deputy prime minister, said: “What we have seen in these escalating attacks is that they are going after trains, especially trying to kill the drivers.” Ukraine has recorded a threefold increase in the number of attacks on its railway system since July , according to a senior minister, as Moscow seeks to scupper one of Kyiv’s key logistical systems, Peter Beaumont writes . The rail network carries more than 63% of the country’s freight – including grain shipments – and 37% of passenger traffic, according to the state statistics service. Military assistance from foreign countries often arrives by train. Oleksii Kuleba, a deputy prime minister, said: “What we have seen in these escalating attacks is that they are going after trains, especially trying to kill the drivers.” Volodymyr Zelenskyy has announced an overhaul of state-owned energy companies amid a corruption scandal. Anti-graft investigators allege around $100m has been embezzled. Zelenskyy has already ordered two ministers to resign over the alleged scheme and sanctioned a former business partner who was named as its mastermind. “Alongside a full audit of their financial activities, the management of these companies is to be renewed,” Zelenskyy said. Volodymyr Zelenskyy has announced an overhaul of state-owned energy companies amid a corruption scandal. Anti-graft investigators allege around $100m has been embezzled. Zelenskyy has already ordered two ministers to resign over the alleged scheme and sanctioned a former business partner who was named as its mastermind. “Alongside a full audit of their financial activities, the management of these companies is to be renewed,” Zelenskyy said. The Ukrainian president called for a new supervisory board at Energoatom – the state nuclear company – “within a week” that would enable a “complete overhaul of the company’s management”. He also called for the quick appointment of a new head of hydropower generating company Ukrhydroenergo and other reforms for oil and gas giant Naftogaz and the main gas operator. The Ukrainian president called for a new supervisory board at Energoatom – the state nuclear company – “within a week” that would enable a “complete overhaul of the company’s management”. He also called for the quick appointment of a new head of hydropower generating company Ukrhydroenergo and other reforms for oil and gas giant Naftogaz and the main gas operator. Ukraine Russia-Ukraine war at a glance Russia Europe explainers",1347,329
